{
  "$schema": "http://json-schema.org/draft-07/schema#",
  "title": "Skills Configuration Schema",
  "description": "Schema for the skills configuration file",
  "type": "object",
  "properties": {
    "combat": {
      "type": "object",
      "patternProperties": {
        "^[a-zA-Z0-9\\s]+$": {
          "type": "object",
          "properties": {
            "description": {
              "type": "string",
              "minLength": 1
            },
            "requires": {
              "type": "object",
              "properties": {
                "skill": {
                  "type": "string",
                  "minLength": 1
                },
                "level": {
                  "type": "number",
                  "minimum": 1
                }
              },
              "required": ["skill", "level"],
              "additionalProperties": false
            },
            "sub_skills": {
              "type": "object",
              "patternProperties": {
                "^[a-zA-Z0-9\\s]+$": {
                  "type": "object",
                  "properties": {
                    "description": {
                      "type": "string",
                      "minLength": 1
                    }
                  },
                  "required": ["description"],
                  "additionalProperties": false
                }
              },
              "additionalProperties": false
            }
          },
          "required": ["description"],
          "additionalProperties": false
        }
      },
      "additionalProperties": false
    },
    "magic": {
      "type": "object",
      "patternProperties": {
        "^[a-zA-Z0-9\\s]+$": {
          "type": "object",
          "properties": {
            "description": {
              "type": "string",
              "minLength": 1
            },
            "requires": {
              "type": "object",
              "properties": {
                "skill": {
                  "type": "string",
                  "minLength": 1
                },
                "level": {
                  "type": "number",
                  "minimum": 1
                }
              },
              "required": ["skill", "level"],
              "additionalProperties": false
            },
            "sub_skills": {
              "type": "object",
              "patternProperties": {
                "^[a-zA-Z0-9\\s]+$": {
                  "type": "object",
                  "properties": {
                    "description": {
                      "type": "string",
                      "minLength": 1
                    }
                  },
                  "required": ["description"],
                  "additionalProperties": false
                }
              },
              "additionalProperties": false
            }
          },
          "required": ["description"],
          "additionalProperties": false
        }
      },
      "additionalProperties": false
    },
    "crafting": {
      "type": "object",
      "patternProperties": {
        "^[a-zA-Z0-9\\s]+$": {
          "type": "object",
          "properties": {
            "description": {
              "type": "string",
              "minLength": 1
            },
            "requires": {
              "type": "object",
              "properties": {
                "skill": {
                  "type": "string",
                  "minLength": 1
                },
                "level": {
                  "type": "number",
                  "minimum": 1
                }
              },
              "required": ["skill", "level"],
              "additionalProperties": false
            },
            "sub_skills": {
              "type": "object",
              "patternProperties": {
                "^[a-zA-Z0-9\\s]+$": {
                  "type": "object",
                  "properties": {
                    "description": {
                      "type": "string",
                      "minLength": 1
                    }
                  },
                  "required": ["description"],
                  "additionalProperties": false
                }
              },
              "additionalProperties": false
            }
          },
          "required": ["description"],
          "additionalProperties": false
        }
      },
      "additionalProperties": false
    },
    "survival": {
      "type": "object",
      "patternProperties": {
        "^[a-zA-Z0-9\\s]+$": {
          "type": "object",
          "properties": {
            "description": {
              "type": "string",
              "minLength": 1
            },
            "requires": {
              "type": "object",
              "properties": {
                "skill": {
                  "type": "string",
                  "minLength": 1
                },
                "level": {
                  "type": "number",
                  "minimum": 1
                }
              },
              "required": ["skill", "level"],
              "additionalProperties": false
            },
            "sub_skills": {
              "type": "object",
              "patternProperties": {
                "^[a-zA-Z0-9\\s]+$": {
                  "type": "object",
                  "properties": {
                    "description": {
                      "type": "string",
                      "minLength": 1
                    }
                  },
                  "required": ["description"],
                  "additionalProperties": false
                }
              },
              "additionalProperties": false
            }
          },
          "required": ["description"],
          "additionalProperties": false
        }
      },
      "additionalProperties": false
    },
    "professional": {
      "type": "object",
      "patternProperties": {
        "^[a-zA-Z0-9\\s]+$": {
          "type": "object",
          "properties": {
            "description": {
              "type": "string",
              "minLength": 1
            },
            "requires": {
              "type": "object",
              "properties": {
                "skill": {
                  "type": "string",
                  "minLength": 1
                },
                "level": {
                  "type": "number",
                  "minimum": 1
                }
              },
              "required": ["skill", "level"],
              "additionalProperties": false
            },
            "sub_skills": {
              "type": "object",
              "patternProperties": {
                "^[a-zA-Z0-9\\s]+$": {
                  "type": "object",
                  "properties": {
                    "description": {
                      "type": "string",
                      "minLength": 1
                    }
                  },
                  "required": ["description"],
                  "additionalProperties": false
                }
              },
              "additionalProperties": false
            }
          },
          "required": ["description"],
          "additionalProperties": false
        }
      },
      "additionalProperties": false
    },
    "skill_categories": {
      "type": "array",
      "items": {
        "type": "object",
        "properties": {
          "id": {
            "type": "string",
            "minLength": 1
          },
          "name": {
            "type": "string",
            "minLength": 1
          }
        },
        "required": ["id", "name"],
        "additionalProperties": false
      }
    },
    "skills": {
      "type": "object",
      "patternProperties": {
        "^[a-zA-Z0-9\\s]+$": {
          "type": "object",
          "properties": {
            "type": {
              "type": "string",
              "minLength": 1
            },
            "icon": {
              "type": "string",
              "minLength": 1
            },
            "description": {
              "type": "string",
              "minLength": 1
            },
            "requires": {
              "type": "object",
              "properties": {
                "skill": {
                  "type": "string",
                  "minLength": 1
                },
                "level": {
                  "type": "number",
                  "minimum": 1
                }
              },
              "required": ["skill", "level"],
              "additionalProperties": false
            }
          },
          "required": ["type", "icon", "description"],
          "additionalProperties": false
        }
      },
      "additionalProperties": false
    }
  },
  "additionalProperties": false
} 